{
  "id": "moe1996-14162",
  "traditional": "安寧",
  "simplified": "安宁",
  "constituent_chars": [
    "U+5B89",
    "U+5BE7"
  ],
  "pinyin": [
    {
      "reading": "ān níng",
      "context": "dictionary_entry",
      "source_entry_ids": [
        "580600018"
      ]
    }
  ],
  "zhuyin": [
    {
      "reading": "ㄢ ㄋㄧㄥˊ",
      "pinyin": "ān níng",
      "source_entry_ids": [
        "580600018"
      ]
    }
  ],
  "definitions": [
    {
      "gloss": "see 安寧區|安宁区[An1 ning2 Qu1]",
      "lang": "en",
      "register": "modern",
      "source_entry_indices": [
        31903
      ]
    },
    {
      "gloss": "see 安寧市|安宁市[An1 ning2 Shi4]",
      "lang": "en",
      "register": "modern",
      "source_entry_indices": [
        31903
      ]
    },
    {
      "gloss": "peaceful",
      "lang": "en",
      "register": "modern",
      "source_entry_indices": [
        31904
      ]
    },
    {
      "gloss": "tranquil",
      "lang": "en",
      "register": "modern",
      "source_entry_indices": [
        31904
      ]
    },
    {
      "gloss": "calm",
      "lang": "en",
      "register": "modern",
      "source_entry_indices": [
        31904
      ]
    },
    {
      "gloss": "composed",
      "lang": "en",
      "register": "modern",
      "source_entry_indices": [
        31904
      ]
    },
    {
      "gloss": "free from worry",
      "lang": "en",
      "register": "modern",
      "source_entry_indices": [
        31904
      ]
    }
  ],
  "frequency": {
    "rank": 14162,
    "corpus_id": "moe-tw-common-terms-1996",
    "count": 3,
    "cumulative_count": 571966,
    "percentage": 0.00048598,
    "cumulative_percentage": 92.65518236,
    "per_million": 4.859826,
    "corpus_total_count": 617306
  },
  "grading": {
    "hsk": null
  },
  "segmentation_tool": null,
  "cc_cedict_entry_indices": [
    31903,
    31904
  ],
  "sources": {
    "id": [
      "moe-tw-common-terms-1996"
    ],
    "traditional": [
      "moe-tw-common-terms-1996",
      "cc-cedict-editor-2026-08-11"
    ],
    "constituent_chars": [
      "moe-tw-common-terms-1996"
    ],
    "definitions": [
      "cc-cedict-editor-2026-08-11"
    ],
    "frequency": [
      "moe-tw-common-terms-1996"
    ],
    "cc_cedict_entry_indices": [
      "cc-cedict-editor-2026-08-11"
    ],
    "simplified": [
      "cc-cedict-editor-2026-08-11"
    ],
    "pinyin": [
      "moe-tw-concised-dictionary-2014-20260626"
    ],
    "zhuyin": [
      "moe-tw-concised-dictionary-2014-20260626"
    ],
    "definitions_zh_TW": [
      "moe-tw-concised-dictionary-2014-20260626"
    ]
  },
  "gaps": [
    {
      "field": "grading.hsk",
      "reason": "source_unavailable",
      "detail": "No versioned redistribution-approved HSK word source passed the Phase 0 audit."
    },
    {
      "field": "segmentation_tool",
      "reason": "source_unavailable",
      "detail": "The MOE release publishes word-frequency rows but does not identify a named segmentation tool."
    }
  ],
  "conflicts": [],
  "definitions_zh_TW": [
    {
      "text": "1.心裡安定平靜。[例]這座社區環境整潔清幽，居住其中，使人覺得十分安寧。\n2.秩序正常，沒有侵擾。[例]維持社會秩序安寧是警察的責任。",
      "lang": "zh-Hant-TW",
      "register": "dictionary",
      "source_id": "moe-tw-concised-dictionary-2014-20260626",
      "source_entry_id": "580600018",
      "verbatim": true
    }
  ]
}
