{
  "id": "moe1996-11676",
  "traditional": "抄襲",
  "simplified": "抄袭",
  "constituent_chars": [
    "U+6284",
    "U+8972"
  ],
  "pinyin": [
    {
      "reading": "chāo xí",
      "context": "dictionary_entry",
      "source_entry_ids": [
        "468200005"
      ]
    }
  ],
  "zhuyin": [
    {
      "reading": "ㄔㄠ ㄒㄧˊ",
      "pinyin": "chāo xí",
      "source_entry_ids": [
        "468200005"
      ]
    }
  ],
  "definitions": [
    {
      "gloss": "to plagiarize",
      "lang": "en",
      "register": "modern",
      "source_entry_indices": [
        45222
      ]
    },
    {
      "gloss": "to copy",
      "lang": "en",
      "register": "modern",
      "source_entry_indices": [
        45222
      ]
    },
    {
      "gloss": "to attack the flank or rear of an enemy",
      "lang": "en",
      "register": "modern",
      "source_entry_indices": [
        45222
      ]
    }
  ],
  "frequency": {
    "rank": 11676,
    "corpus_id": "moe-tw-common-terms-1996",
    "count": 4,
    "cumulative_count": 562767,
    "percentage": 0.00064798,
    "cumulative_percentage": 91.16499759,
    "per_million": 6.479769,
    "corpus_total_count": 617306
  },
  "grading": {
    "hsk": null
  },
  "segmentation_tool": null,
  "cc_cedict_entry_indices": [
    45222
  ],
  "sources": {
    "id": [
      "moe-tw-common-terms-1996"
    ],
    "traditional": [
      "moe-tw-common-terms-1996",
      "cc-cedict-editor-2026-08-11"
    ],
    "constituent_chars": [
      "moe-tw-common-terms-1996"
    ],
    "definitions": [
      "cc-cedict-editor-2026-08-11"
    ],
    "frequency": [
      "moe-tw-common-terms-1996"
    ],
    "cc_cedict_entry_indices": [
      "cc-cedict-editor-2026-08-11"
    ],
    "simplified": [
      "cc-cedict-editor-2026-08-11"
    ],
    "pinyin": [
      "moe-tw-concised-dictionary-2014-20260626"
    ],
    "zhuyin": [
      "moe-tw-concised-dictionary-2014-20260626"
    ],
    "definitions_zh_TW": [
      "moe-tw-concised-dictionary-2014-20260626"
    ]
  },
  "gaps": [
    {
      "field": "constituent_chars.local_records",
      "reason": "source_unavailable",
      "detail": "The word contains unified Han characters outside the Phase 3 top-2,000 set: U+6284"
    },
    {
      "field": "grading.hsk",
      "reason": "source_unavailable",
      "detail": "No versioned redistribution-approved HSK word source passed the Phase 0 audit."
    },
    {
      "field": "segmentation_tool",
      "reason": "source_unavailable",
      "detail": "The MOE release publishes word-frequency rows but does not identify a named segmentation tool."
    }
  ],
  "conflicts": [],
  "definitions_zh_TW": [
    {
      "text": "1.抄錄或因襲模仿他人作品以為己作。[例]這篇散文因有抄襲嫌疑而被取消名次。\n2.軍隊繞道前進，由敵軍的側面或背面突擊。[例]我方採抄襲戰略而大敗敵軍。",
      "lang": "zh-Hant-TW",
      "register": "dictionary",
      "source_id": "moe-tw-concised-dictionary-2014-20260626",
      "source_entry_id": "468200005",
      "verbatim": true
    }
  ]
}
