{
  "id": "moe1996-03833",
  "traditional": "下旬",
  "simplified": "下旬",
  "constituent_chars": [
    "U+4E0B",
    "U+65EC"
  ],
  "pinyin": [
    {
      "reading": "xià xún",
      "context": "dictionary_entry",
      "source_entry_ids": [
        "390700057"
      ]
    }
  ],
  "zhuyin": [
    {
      "reading": "ㄒㄧㄚˋ ㄒㄩㄣˊ",
      "pinyin": "xià xún",
      "source_entry_ids": [
        "390700057"
      ]
    }
  ],
  "definitions": [
    {
      "gloss": "last third of the month",
      "lang": "en",
      "register": "modern",
      "source_entry_indices": [
        1948
      ]
    }
  ],
  "frequency": {
    "rank": 3833,
    "corpus_id": "moe-tw-common-terms-1996",
    "count": 17,
    "cumulative_count": 497714,
    "percentage": 0.0027539,
    "cumulative_percentage": 80.62678801,
    "per_million": 27.539016,
    "corpus_total_count": 617306
  },
  "grading": {
    "hsk": null
  },
  "segmentation_tool": null,
  "cc_cedict_entry_indices": [
    1948
  ],
  "sources": {
    "id": [
      "moe-tw-common-terms-1996"
    ],
    "traditional": [
      "moe-tw-common-terms-1996",
      "cc-cedict-editor-2026-08-11"
    ],
    "constituent_chars": [
      "moe-tw-common-terms-1996"
    ],
    "definitions": [
      "cc-cedict-editor-2026-08-11"
    ],
    "frequency": [
      "moe-tw-common-terms-1996"
    ],
    "cc_cedict_entry_indices": [
      "cc-cedict-editor-2026-08-11"
    ],
    "simplified": [
      "cc-cedict-editor-2026-08-11"
    ],
    "pinyin": [
      "moe-tw-concised-dictionary-2014-20260626"
    ],
    "zhuyin": [
      "moe-tw-concised-dictionary-2014-20260626"
    ],
    "definitions_zh_TW": [
      "moe-tw-concised-dictionary-2014-20260626"
    ]
  },
  "gaps": [
    {
      "field": "grading.hsk",
      "reason": "source_unavailable",
      "detail": "No versioned redistribution-approved HSK word source passed the Phase 0 audit."
    },
    {
      "field": "segmentation_tool",
      "reason": "source_unavailable",
      "detail": "The MOE release publishes word-frequency rows but does not identify a named segmentation tool."
    }
  ],
  "conflicts": [],
  "definitions_zh_TW": [
    {
      "text": "十日為一旬，「下旬」指每個月二十一日到月底這一段時間。[例]他將在本月下旬赴美求學，攻讀博士學位。",
      "lang": "zh-Hant-TW",
      "register": "dictionary",
      "source_id": "moe-tw-concised-dictionary-2014-20260626",
      "source_entry_id": "390700057",
      "verbatim": true
    }
  ]
}
