{
  "id": "moe1996-09261",
  "traditional": "遇上",
  "simplified": "遇上",
  "constituent_chars": [
    "U+9047",
    "U+4E0A"
  ],
  "pinyin": [
    {
      "reading": "yù shàng",
      "context": "dictionary_entry",
      "source_entry_ids": [
        "650000008"
      ]
    }
  ],
  "zhuyin": [
    {
      "reading": "ㄩˋ ㄕㄤˋ",
      "pinyin": "yù shàng",
      "source_entry_ids": [
        "650000008"
      ]
    }
  ],
  "definitions": [
    {
      "gloss": "to come across (sb)",
      "lang": "en",
      "register": "modern",
      "source_entry_indices": [
        108005
      ]
    },
    {
      "gloss": "to run into",
      "lang": "en",
      "register": "modern",
      "source_entry_indices": [
        108005
      ]
    }
  ],
  "frequency": {
    "rank": 9261,
    "corpus_id": "moe-tw-common-terms-1996",
    "count": 6,
    "cumulative_count": 550965,
    "percentage": 0.00097197,
    "cumulative_percentage": 89.25314188,
    "per_million": 9.719653,
    "corpus_total_count": 617306
  },
  "grading": {
    "hsk": null
  },
  "segmentation_tool": null,
  "cc_cedict_entry_indices": [
    108005
  ],
  "sources": {
    "id": [
      "moe-tw-common-terms-1996"
    ],
    "traditional": [
      "moe-tw-common-terms-1996",
      "cc-cedict-editor-2026-08-11"
    ],
    "constituent_chars": [
      "moe-tw-common-terms-1996"
    ],
    "definitions": [
      "cc-cedict-editor-2026-08-11"
    ],
    "frequency": [
      "moe-tw-common-terms-1996"
    ],
    "cc_cedict_entry_indices": [
      "cc-cedict-editor-2026-08-11"
    ],
    "simplified": [
      "cc-cedict-editor-2026-08-11"
    ],
    "pinyin": [
      "moe-tw-concised-dictionary-2014-20260626"
    ],
    "zhuyin": [
      "moe-tw-concised-dictionary-2014-20260626"
    ],
    "definitions_zh_TW": [
      "moe-tw-concised-dictionary-2014-20260626"
    ]
  },
  "gaps": [
    {
      "field": "grading.hsk",
      "reason": "source_unavailable",
      "detail": "No versioned redistribution-approved HSK word source passed the Phase 0 audit."
    },
    {
      "field": "segmentation_tool",
      "reason": "source_unavailable",
      "detail": "The MOE release publishes word-frequency rows but does not identify a named segmentation tool."
    }
  ],
  "conflicts": [],
  "definitions_zh_TW": [
    {
      "text": "碰到。[例]他從銀行出來的時候，不巧被債主遇上了，逼著他還錢。",
      "lang": "zh-Hant-TW",
      "register": "dictionary",
      "source_id": "moe-tw-concised-dictionary-2014-20260626",
      "source_entry_id": "650000008",
      "verbatim": true
    }
  ]
}
