{
  "id": "moe1996-10906",
  "traditional": "樹枝",
  "simplified": "树枝",
  "constituent_chars": [
    "U+6A39",
    "U+679D"
  ],
  "pinyin": [
    {
      "reading": "shù zhī",
      "context": "dictionary_entry",
      "source_entry_ids": [
        "514500010"
      ]
    }
  ],
  "zhuyin": [
    {
      "reading": "ㄕㄨˋ ㄓ",
      "pinyin": "shù zhī",
      "source_entry_ids": [
        "514500010"
      ]
    }
  ],
  "definitions": [
    {
      "gloss": "branch",
      "lang": "en",
      "register": "modern",
      "source_entry_indices": [
        59130
      ]
    },
    {
      "gloss": "twig",
      "lang": "en",
      "register": "modern",
      "source_entry_indices": [
        59130
      ]
    }
  ],
  "frequency": {
    "rank": 10906,
    "corpus_id": "moe-tw-common-terms-1996",
    "count": 5,
    "cumulative_count": 559497,
    "percentage": 0.00080997,
    "cumulative_percentage": 90.63527651,
    "per_million": 8.099711,
    "corpus_total_count": 617306
  },
  "grading": {
    "hsk": null
  },
  "segmentation_tool": null,
  "cc_cedict_entry_indices": [
    59130
  ],
  "sources": {
    "id": [
      "moe-tw-common-terms-1996"
    ],
    "traditional": [
      "moe-tw-common-terms-1996",
      "cc-cedict-editor-2026-08-11"
    ],
    "constituent_chars": [
      "moe-tw-common-terms-1996"
    ],
    "definitions": [
      "cc-cedict-editor-2026-08-11"
    ],
    "frequency": [
      "moe-tw-common-terms-1996"
    ],
    "cc_cedict_entry_indices": [
      "cc-cedict-editor-2026-08-11"
    ],
    "simplified": [
      "cc-cedict-editor-2026-08-11"
    ],
    "pinyin": [
      "moe-tw-concised-dictionary-2014-20260626"
    ],
    "zhuyin": [
      "moe-tw-concised-dictionary-2014-20260626"
    ],
    "definitions_zh_TW": [
      "moe-tw-concised-dictionary-2014-20260626"
    ]
  },
  "gaps": [
    {
      "field": "grading.hsk",
      "reason": "source_unavailable",
      "detail": "No versioned redistribution-approved HSK word source passed the Phase 0 audit."
    },
    {
      "field": "segmentation_tool",
      "reason": "source_unavailable",
      "detail": "The MOE release publishes word-frequency rows but does not identify a named segmentation tool."
    }
  ],
  "conflicts": [],
  "definitions_zh_TW": [
    {
      "text": "從樹幹旁生出的枝條。[例]一陣風吹過，看樹枝搖曳，樹影婆娑。",
      "lang": "zh-Hant-TW",
      "register": "dictionary",
      "source_id": "moe-tw-concised-dictionary-2014-20260626",
      "source_entry_id": "514500010",
      "verbatim": true
    }
  ]
}
