{
  "id": "moe1996-05133",
  "traditional": "在乎",
  "simplified": "在乎",
  "constituent_chars": [
    "U+5728",
    "U+4E4E"
  ],
  "pinyin": [
    {
      "reading": "zài hū",
      "context": "dictionary_entry",
      "source_entry_ids": [
        "532500006"
      ]
    }
  ],
  "zhuyin": [
    {
      "reading": "ㄗㄞˋ ㄏㄨ",
      "pinyin": "zài hū",
      "source_entry_ids": [
        "532500006"
      ]
    }
  ],
  "definitions": [
    {
      "gloss": "to rest with; to lie in; to be due to (a certain attribute)",
      "lang": "en",
      "register": "modern",
      "source_entry_indices": [
        24824
      ]
    },
    {
      "gloss": "(often used in the negative) to care about",
      "lang": "en",
      "register": "modern",
      "source_entry_indices": [
        24824
      ]
    }
  ],
  "frequency": {
    "rank": 5133,
    "corpus_id": "moe-tw-common-terms-1996",
    "count": 12,
    "cumulative_count": 516655,
    "percentage": 0.00194393,
    "cumulative_percentage": 83.69512041,
    "per_million": 19.439306,
    "corpus_total_count": 617306
  },
  "grading": {
    "hsk": null
  },
  "segmentation_tool": null,
  "cc_cedict_entry_indices": [
    24824
  ],
  "sources": {
    "id": [
      "moe-tw-common-terms-1996"
    ],
    "traditional": [
      "moe-tw-common-terms-1996",
      "cc-cedict-editor-2026-08-11"
    ],
    "constituent_chars": [
      "moe-tw-common-terms-1996"
    ],
    "definitions": [
      "cc-cedict-editor-2026-08-11"
    ],
    "frequency": [
      "moe-tw-common-terms-1996"
    ],
    "cc_cedict_entry_indices": [
      "cc-cedict-editor-2026-08-11"
    ],
    "simplified": [
      "cc-cedict-editor-2026-08-11"
    ],
    "pinyin": [
      "moe-tw-concised-dictionary-2014-20260626"
    ],
    "zhuyin": [
      "moe-tw-concised-dictionary-2014-20260626"
    ],
    "definitions_zh_TW": [
      "moe-tw-concised-dictionary-2014-20260626"
    ]
  },
  "gaps": [
    {
      "field": "grading.hsk",
      "reason": "source_unavailable",
      "detail": "No versioned redistribution-approved HSK word source passed the Phase 0 audit."
    },
    {
      "field": "segmentation_tool",
      "reason": "source_unavailable",
      "detail": "The MOE release publishes word-frequency rows but does not identify a named segmentation tool."
    }
  ],
  "conflicts": [
    {
      "field": "pinyin",
      "resolution": "taiwan_moe_canonical",
      "values": [
        {
          "value": [
            "zài hū"
          ],
          "source_ids": [
            "moe-tw-concised-dictionary-2014-20260626"
          ],
          "source_entry_ids": [
            "532500006"
          ]
        },
        {
          "value": [
            "zài hu"
          ],
          "source_ids": [
            "cc-cedict-editor-2026-08-11"
          ],
          "source_entry_indices": [
            24824
          ]
        }
      ],
      "detail": "The exact Taiwan MOE Concised Dictionary headword reading is canonical for this Traditional-first corpus. The differing CC-CEDICT reading set is retained as regional or lexical comparison evidence."
    }
  ],
  "definitions_zh_TW": [
    {
      "text": "在意、關心。[例]他總是我行我素，從不在乎別人的眼光。",
      "lang": "zh-Hant-TW",
      "register": "dictionary",
      "source_id": "moe-tw-concised-dictionary-2014-20260626",
      "source_entry_id": "532500006",
      "verbatim": true
    }
  ]
}
