{
  "id": "moe1996-06121",
  "traditional": "揮",
  "simplified": "挥",
  "constituent_chars": [
    "U+63EE"
  ],
  "pinyin": [
    {
      "reading": "huī",
      "context": "dictionary_entry",
      "source_entry_ids": [
        "2888"
      ]
    }
  ],
  "zhuyin": [
    {
      "reading": "ㄏㄨㄟ",
      "pinyin": "huī",
      "source_entry_ids": [
        "2888"
      ]
    }
  ],
  "definitions": [
    {
      "gloss": "to wave",
      "lang": "en",
      "register": "modern",
      "source_entry_indices": [
        48361
      ]
    },
    {
      "gloss": "to brandish",
      "lang": "en",
      "register": "modern",
      "source_entry_indices": [
        48361
      ]
    },
    {
      "gloss": "to command",
      "lang": "en",
      "register": "modern",
      "source_entry_indices": [
        48361
      ]
    },
    {
      "gloss": "to conduct",
      "lang": "en",
      "register": "modern",
      "source_entry_indices": [
        48361
      ]
    },
    {
      "gloss": "to scatter",
      "lang": "en",
      "register": "modern",
      "source_entry_indices": [
        48361
      ]
    },
    {
      "gloss": "to disperse",
      "lang": "en",
      "register": "modern",
      "source_entry_indices": [
        48361
      ]
    }
  ],
  "frequency": {
    "rank": 6121,
    "corpus_id": "moe-tw-common-terms-1996",
    "count": 10,
    "cumulative_count": 527512,
    "percentage": 0.00161994,
    "cumulative_percentage": 85.45389159,
    "per_million": 16.199421,
    "corpus_total_count": 617306
  },
  "grading": {
    "hsk": null
  },
  "segmentation_tool": null,
  "cc_cedict_entry_indices": [
    48361
  ],
  "sources": {
    "id": [
      "moe-tw-common-terms-1996"
    ],
    "traditional": [
      "moe-tw-common-terms-1996",
      "cc-cedict-editor-2026-08-11"
    ],
    "constituent_chars": [
      "moe-tw-common-terms-1996"
    ],
    "definitions": [
      "cc-cedict-editor-2026-08-11"
    ],
    "frequency": [
      "moe-tw-common-terms-1996"
    ],
    "cc_cedict_entry_indices": [
      "cc-cedict-editor-2026-08-11"
    ],
    "simplified": [
      "cc-cedict-editor-2026-08-11"
    ],
    "pinyin": [
      "moe-tw-concised-dictionary-2014-20260626"
    ],
    "zhuyin": [
      "moe-tw-concised-dictionary-2014-20260626"
    ],
    "definitions_zh_TW": [
      "moe-tw-concised-dictionary-2014-20260626"
    ]
  },
  "gaps": [
    {
      "field": "grading.hsk",
      "reason": "source_unavailable",
      "detail": "No versioned redistribution-approved HSK word source passed the Phase 0 audit."
    },
    {
      "field": "segmentation_tool",
      "reason": "source_unavailable",
      "detail": "The MOE release publishes word-frequency rows but does not identify a named segmentation tool."
    }
  ],
  "conflicts": [],
  "definitions_zh_TW": [
    {
      "text": "1.搖動、擺動。[例]揮毫、揮扇、揮手　◎\n2.發散、拋灑。[例]揮發、揮灑、揮金如土\n3.發號、率領。[例]揮兵、指揮、揮令前進",
      "lang": "zh-Hant-TW",
      "register": "dictionary",
      "source_id": "moe-tw-concised-dictionary-2014-20260626",
      "source_entry_id": "2888",
      "verbatim": true
    }
  ]
}
