{
  "id": "moe1996-07741",
  "traditional": "宋",
  "simplified": "宋",
  "constituent_chars": [
    "U+5B8B"
  ],
  "pinyin": [
    {
      "reading": "sòng",
      "context": "dictionary_entry",
      "source_entry_ids": [
        "5705"
      ]
    }
  ],
  "zhuyin": [
    {
      "reading": "ㄙㄨㄥˋ",
      "pinyin": "sòng",
      "source_entry_ids": [
        "5705"
      ]
    }
  ],
  "definitions": [
    {
      "gloss": "surname Song",
      "lang": "en",
      "register": "modern",
      "source_entry_indices": [
        32081
      ]
    },
    {
      "gloss": "the Song dynasty (960–1279)",
      "lang": "en",
      "register": "modern",
      "source_entry_indices": [
        32081
      ]
    },
    {
      "gloss": "Song of the Southern Dynasties (420–479) 南朝宋[Nan2 chao2 Song4]",
      "lang": "en",
      "register": "modern",
      "source_entry_indices": [
        32081
      ]
    }
  ],
  "frequency": {
    "rank": 7741,
    "corpus_id": "moe-tw-common-terms-1996",
    "count": 7,
    "cumulative_count": 541185,
    "percentage": 0.00113396,
    "cumulative_percentage": 87.66883847,
    "per_million": 11.339595,
    "corpus_total_count": 617306
  },
  "grading": {
    "hsk": null
  },
  "segmentation_tool": null,
  "cc_cedict_entry_indices": [
    32081
  ],
  "sources": {
    "id": [
      "moe-tw-common-terms-1996"
    ],
    "traditional": [
      "moe-tw-common-terms-1996",
      "cc-cedict-editor-2026-08-11"
    ],
    "constituent_chars": [
      "moe-tw-common-terms-1996"
    ],
    "definitions": [
      "cc-cedict-editor-2026-08-11"
    ],
    "frequency": [
      "moe-tw-common-terms-1996"
    ],
    "cc_cedict_entry_indices": [
      "cc-cedict-editor-2026-08-11"
    ],
    "simplified": [
      "cc-cedict-editor-2026-08-11"
    ],
    "pinyin": [
      "moe-tw-concised-dictionary-2014-20260626"
    ],
    "zhuyin": [
      "moe-tw-concised-dictionary-2014-20260626"
    ],
    "definitions_zh_TW": [
      "moe-tw-concised-dictionary-2014-20260626"
    ]
  },
  "gaps": [
    {
      "field": "grading.hsk",
      "reason": "source_unavailable",
      "detail": "No versioned redistribution-approved HSK word source passed the Phase 0 audit."
    },
    {
      "field": "segmentation_tool",
      "reason": "source_unavailable",
      "detail": "The MOE release publishes word-frequency rows but does not identify a named segmentation tool."
    }
  ],
  "conflicts": [],
  "definitions_zh_TW": [
    {
      "text": "1.古國名。周朝分封微子所建的諸侯國。故址在今河南省商邱縣南，後為齊所滅。\r\n2.朝代名：(1) （西元420∼479）南朝之一，劉裕開國，建都建康，後為蕭道成所篡。史稱「劉宋」。　(2) （西元960∼1279）自趙匡胤建都汴京至為蒙元所滅止，歷十八帝，三百二十年。自太祖傳至徽、欽二宗為金人所執，史稱「北宋」。高宗南渡建都臨安，保南方之地，史稱為「南宋」。\r\n3.姓。",
      "lang": "zh-Hant-TW",
      "register": "dictionary",
      "source_id": "moe-tw-concised-dictionary-2014-20260626",
      "source_entry_id": "5705",
      "verbatim": true
    }
  ]
}
