{
  "id": "moe1996-01582",
  "traditional": "龐大",
  "simplified": "庞大",
  "constituent_chars": [
    "U+9F90",
    "U+5927"
  ],
  "pinyin": [
    {
      "reading": "páng dà",
      "context": "dictionary_entry",
      "source_entry_ids": [
        "039200001"
      ]
    }
  ],
  "zhuyin": [
    {
      "reading": "ㄆㄤˊ ㄉㄚˋ",
      "pinyin": "páng dà",
      "source_entry_ids": [
        "039200001"
      ]
    }
  ],
  "definitions": [
    {
      "gloss": "huge; enormous; tremendous",
      "lang": "en",
      "register": "modern",
      "source_entry_indices": [
        124739
      ]
    }
  ],
  "frequency": {
    "rank": 1582,
    "corpus_id": "moe-tw-common-terms-1996",
    "count": 49,
    "cumulative_count": 434010,
    "percentage": 0.00793772,
    "cumulative_percentage": 70.30710863,
    "per_million": 79.377165,
    "corpus_total_count": 617306
  },
  "grading": {
    "hsk": null
  },
  "segmentation_tool": null,
  "cc_cedict_entry_indices": [
    124739
  ],
  "sources": {
    "id": [
      "moe-tw-common-terms-1996"
    ],
    "traditional": [
      "moe-tw-common-terms-1996",
      "cc-cedict-editor-2026-08-11"
    ],
    "constituent_chars": [
      "moe-tw-common-terms-1996"
    ],
    "definitions": [
      "cc-cedict-editor-2026-08-11"
    ],
    "frequency": [
      "moe-tw-common-terms-1996"
    ],
    "cc_cedict_entry_indices": [
      "cc-cedict-editor-2026-08-11"
    ],
    "simplified": [
      "cc-cedict-editor-2026-08-11"
    ],
    "pinyin": [
      "moe-tw-concised-dictionary-2014-20260626"
    ],
    "zhuyin": [
      "moe-tw-concised-dictionary-2014-20260626"
    ],
    "definitions_zh_TW": [
      "moe-tw-concised-dictionary-2014-20260626"
    ]
  },
  "gaps": [
    {
      "field": "grading.hsk",
      "reason": "source_unavailable",
      "detail": "No versioned redistribution-approved HSK word source passed the Phase 0 audit."
    },
    {
      "field": "segmentation_tool",
      "reason": "source_unavailable",
      "detail": "The MOE release publishes word-frequency rows but does not identify a named segmentation tool."
    }
  ],
  "conflicts": [],
  "definitions_zh_TW": [
    {
      "text": "形容數量或形體極大。[例]身軀龐大、體積龐大、數目龐大",
      "lang": "zh-Hant-TW",
      "register": "dictionary",
      "source_id": "moe-tw-concised-dictionary-2014-20260626",
      "source_entry_id": "039200001",
      "verbatim": true
    }
  ]
}
