{
  "id": "moe1996-01873",
  "traditional": "台商",
  "simplified": "台商",
  "constituent_chars": [
    "U+53F0",
    "U+5546"
  ],
  "pinyin": [
    {
      "reading": "tái shāng",
      "context": "dictionary_entry",
      "source_entry_indices": [
        19258
      ]
    }
  ],
  "zhuyin": [
    {
      "reading": "ㄊㄞˊ ㄕㄤ",
      "pinyin": "tái shāng",
      "source_entry_indices": [
        19258
      ]
    }
  ],
  "definitions": [
    {
      "gloss": "Taiwanese businessperson or company (esp. one operating overseas, often in mainland China)",
      "lang": "en",
      "register": "modern",
      "source_entry_indices": [
        19258
      ]
    }
  ],
  "frequency": {
    "rank": 1873,
    "corpus_id": "moe-tw-common-terms-1996",
    "count": 40,
    "cumulative_count": 446882,
    "percentage": 0.00647977,
    "cumulative_percentage": 72.39229815,
    "per_million": 64.797685,
    "corpus_total_count": 617306
  },
  "grading": {
    "hsk": null
  },
  "segmentation_tool": null,
  "cc_cedict_entry_indices": [
    19258
  ],
  "sources": {
    "id": [
      "moe-tw-common-terms-1996"
    ],
    "traditional": [
      "moe-tw-common-terms-1996",
      "cc-cedict-editor-2026-08-11"
    ],
    "constituent_chars": [
      "moe-tw-common-terms-1996"
    ],
    "definitions": [
      "cc-cedict-editor-2026-08-11"
    ],
    "frequency": [
      "moe-tw-common-terms-1996"
    ],
    "cc_cedict_entry_indices": [
      "cc-cedict-editor-2026-08-11"
    ],
    "simplified": [
      "cc-cedict-editor-2026-08-11"
    ],
    "pinyin": [
      "cc-cedict-editor-2026-08-11"
    ],
    "zhuyin": [
      "cc-cedict-editor-2026-08-11",
      "cns11643-attributes-2026-08-05"
    ]
  },
  "gaps": [
    {
      "field": "definitions_zh_TW",
      "reason": "not_attested",
      "detail": "The exact NFC Traditional headword is absent from both pinned Taiwan MOE dictionary downloads; no definition is inferred through script conversion or approximate matching."
    },
    {
      "field": "grading.hsk",
      "reason": "source_unavailable",
      "detail": "No versioned redistribution-approved HSK word source passed the Phase 0 audit."
    },
    {
      "field": "pinyin.taiwan_verification",
      "reason": "not_attested",
      "detail": "The exact NFC Traditional headword is absent from both pinned Taiwan MOE downloads: the Concised Mandarin Dictionary (2014_20260626) and the Revised Mandarin Dictionary (2015_20260625). Existing CC-CEDICT/CNS pronunciation data is provisional until another Taiwanese lexical authority or a documented manual review confirms the word reading; dictionary absence is not evidence that the reading is invalid."
    },
    {
      "field": "segmentation_tool",
      "reason": "source_unavailable",
      "detail": "The MOE release publishes word-frequency rows but does not identify a named segmentation tool."
    },
    {
      "field": "zhuyin.taiwan_verification",
      "reason": "not_attested",
      "detail": "The exact NFC Traditional headword is absent from both pinned Taiwan MOE downloads: the Concised Mandarin Dictionary (2014_20260626) and the Revised Mandarin Dictionary (2015_20260625). Existing CC-CEDICT/CNS pronunciation data is provisional until another Taiwanese lexical authority or a documented manual review confirms the word reading; dictionary absence is not evidence that the reading is invalid."
    }
  ],
  "conflicts": [],
  "definitions_zh_TW": null
}
