{
  "id": "moe1996-26618",
  "traditional": "充塞",
  "simplified": "充塞",
  "constituent_chars": [
    "U+5145",
    "U+585E"
  ],
  "pinyin": [
    {
      "reading": "chōng sè",
      "context": "dictionary_entry",
      "source_entry_ids": [
        "487400016"
      ]
    }
  ],
  "zhuyin": [
    {
      "reading": "ㄔㄨㄥ ㄙㄜˋ",
      "pinyin": "chōng sè",
      "source_entry_ids": [
        "487400016"
      ]
    }
  ],
  "definitions": [
    {
      "gloss": "congestion",
      "lang": "en",
      "register": "modern",
      "source_entry_indices": [
        10377
      ]
    },
    {
      "gloss": "to block",
      "lang": "en",
      "register": "modern",
      "source_entry_indices": [
        10377
      ]
    },
    {
      "gloss": "to congest",
      "lang": "en",
      "register": "modern",
      "source_entry_indices": [
        10377
      ]
    },
    {
      "gloss": "to crowd",
      "lang": "en",
      "register": "modern",
      "source_entry_indices": [
        10377
      ]
    },
    {
      "gloss": "to choke",
      "lang": "en",
      "register": "modern",
      "source_entry_indices": [
        10377
      ]
    },
    {
      "gloss": "to cram",
      "lang": "en",
      "register": "modern",
      "source_entry_indices": [
        10377
      ]
    },
    {
      "gloss": "to fill up",
      "lang": "en",
      "register": "modern",
      "source_entry_indices": [
        10377
      ]
    },
    {
      "gloss": "to stuff",
      "lang": "en",
      "register": "modern",
      "source_entry_indices": [
        10377
      ]
    },
    {
      "gloss": "to take up all the space",
      "lang": "en",
      "register": "modern",
      "source_entry_indices": [
        10377
      ]
    }
  ],
  "frequency": {
    "rank": 26618,
    "corpus_id": "moe-tw-common-terms-1996",
    "count": 1,
    "cumulative_count": 597203,
    "percentage": 0.00016199,
    "cumulative_percentage": 96.74343032,
    "per_million": 1.619942,
    "corpus_total_count": 617306
  },
  "grading": {
    "hsk": null
  },
  "segmentation_tool": null,
  "cc_cedict_entry_indices": [
    10377
  ],
  "sources": {
    "id": [
      "moe-tw-common-terms-1996"
    ],
    "traditional": [
      "moe-tw-common-terms-1996",
      "cc-cedict-editor-2026-08-11"
    ],
    "constituent_chars": [
      "moe-tw-common-terms-1996"
    ],
    "definitions": [
      "cc-cedict-editor-2026-08-11"
    ],
    "frequency": [
      "moe-tw-common-terms-1996"
    ],
    "cc_cedict_entry_indices": [
      "cc-cedict-editor-2026-08-11"
    ],
    "simplified": [
      "cc-cedict-editor-2026-08-11"
    ],
    "pinyin": [
      "moe-tw-concised-dictionary-2014-20260626"
    ],
    "zhuyin": [
      "moe-tw-concised-dictionary-2014-20260626"
    ],
    "definitions_zh_TW": [
      "moe-tw-concised-dictionary-2014-20260626"
    ]
  },
  "gaps": [
    {
      "field": "grading.hsk",
      "reason": "source_unavailable",
      "detail": "No versioned redistribution-approved HSK word source passed the Phase 0 audit."
    },
    {
      "field": "segmentation_tool",
      "reason": "source_unavailable",
      "detail": "The MOE release publishes word-frequency rows but does not identify a named segmentation tool."
    }
  ],
  "conflicts": [],
  "definitions_zh_TW": [
    {
      "text": "充滿、塞滿。[例]每到晚上，夜來香濃郁的香氣，便充塞了整個房間。",
      "lang": "zh-Hant-TW",
      "register": "dictionary",
      "source_id": "moe-tw-concised-dictionary-2014-20260626",
      "source_entry_id": "487400016",
      "verbatim": true
    }
  ]
}
