{
  "id": "moe1996-13168",
  "traditional": "燕子",
  "simplified": "燕子",
  "constituent_chars": [
    "U+71D5",
    "U+5B50"
  ],
  "pinyin": [
    {
      "reading": "yàn zi",
      "context": "dictionary_entry",
      "source_entry_ids": [
        "612200004"
      ]
    }
  ],
  "zhuyin": [
    {
      "reading": "ㄧㄢˋ ˙ㄗ",
      "pinyin": "yàn zi",
      "source_entry_ids": [
        "612200004"
      ]
    }
  ],
  "definitions": [
    {
      "gloss": "swallow",
      "lang": "en",
      "register": "modern",
      "source_entry_indices": [
        70781
      ]
    }
  ],
  "frequency": {
    "rank": 13168,
    "corpus_id": "moe-tw-common-terms-1996",
    "count": 4,
    "cumulative_count": 568735,
    "percentage": 0.00064798,
    "cumulative_percentage": 92.13177905,
    "per_million": 6.479769,
    "corpus_total_count": 617306
  },
  "grading": {
    "hsk": null
  },
  "segmentation_tool": null,
  "cc_cedict_entry_indices": [
    70781
  ],
  "sources": {
    "id": [
      "moe-tw-common-terms-1996"
    ],
    "traditional": [
      "moe-tw-common-terms-1996",
      "cc-cedict-editor-2026-08-11"
    ],
    "constituent_chars": [
      "moe-tw-common-terms-1996"
    ],
    "definitions": [
      "cc-cedict-editor-2026-08-11"
    ],
    "frequency": [
      "moe-tw-common-terms-1996"
    ],
    "cc_cedict_entry_indices": [
      "cc-cedict-editor-2026-08-11"
    ],
    "simplified": [
      "cc-cedict-editor-2026-08-11"
    ],
    "pinyin": [
      "moe-tw-concised-dictionary-2014-20260626"
    ],
    "zhuyin": [
      "moe-tw-concised-dictionary-2014-20260626"
    ],
    "definitions_zh_TW": [
      "moe-tw-concised-dictionary-2014-20260626"
    ]
  },
  "gaps": [
    {
      "field": "grading.hsk",
      "reason": "source_unavailable",
      "detail": "No versioned redistribution-approved HSK word source passed the Phase 0 audit."
    },
    {
      "field": "segmentation_tool",
      "reason": "source_unavailable",
      "detail": "The MOE release publishes word-frequency rows but does not identify a named segmentation tool."
    }
  ],
  "conflicts": [],
  "definitions_zh_TW": [
    {
      "text": "→燕",
      "lang": "zh-Hant-TW",
      "register": "dictionary",
      "source_id": "moe-tw-concised-dictionary-2014-20260626",
      "source_entry_id": "612200004",
      "verbatim": true
    }
  ]
}
