{
  "id": "moe1996-35403",
  "traditional": "疲弱",
  "simplified": "疲弱",
  "constituent_chars": [
    "U+75B2",
    "U+5F31"
  ],
  "pinyin": [
    {
      "reading": "pí ruò",
      "context": "dictionary_entry",
      "source_entry_ids": [
        "008310018"
      ]
    }
  ],
  "zhuyin": [
    {
      "reading": "ㄆㄧˊ ㄖㄨㄛˋ",
      "pinyin": "pí ruò",
      "source_entry_ids": [
        "008310018"
      ]
    }
  ],
  "definitions": [
    {
      "gloss": "tired",
      "lang": "en",
      "register": "modern",
      "source_entry_indices": [
        75437
      ]
    },
    {
      "gloss": "weak",
      "lang": "en",
      "register": "modern",
      "source_entry_indices": [
        75437
      ]
    },
    {
      "gloss": "exhausted",
      "lang": "en",
      "register": "modern",
      "source_entry_indices": [
        75437
      ]
    }
  ],
  "frequency": {
    "rank": 35403,
    "corpus_id": "moe-tw-common-terms-1996",
    "count": 1,
    "cumulative_count": 605988,
    "percentage": 0.00016199,
    "cumulative_percentage": 98.16654949,
    "per_million": 1.619942,
    "corpus_total_count": 617306
  },
  "grading": {
    "hsk": null
  },
  "segmentation_tool": null,
  "cc_cedict_entry_indices": [
    75437
  ],
  "sources": {
    "id": [
      "moe-tw-common-terms-1996"
    ],
    "traditional": [
      "moe-tw-common-terms-1996",
      "cc-cedict-editor-2026-08-11"
    ],
    "constituent_chars": [
      "moe-tw-common-terms-1996"
    ],
    "definitions": [
      "cc-cedict-editor-2026-08-11"
    ],
    "frequency": [
      "moe-tw-common-terms-1996"
    ],
    "cc_cedict_entry_indices": [
      "cc-cedict-editor-2026-08-11"
    ],
    "simplified": [
      "cc-cedict-editor-2026-08-11"
    ],
    "pinyin": [
      "moe-tw-revised-dictionary-2015-20260625"
    ],
    "zhuyin": [
      "moe-tw-revised-dictionary-2015-20260625"
    ],
    "definitions_zh_TW": [
      "moe-tw-revised-dictionary-2015-20260625"
    ]
  },
  "gaps": [
    {
      "field": "grading.hsk",
      "reason": "source_unavailable",
      "detail": "No versioned redistribution-approved HSK word source passed the Phase 0 audit."
    },
    {
      "field": "segmentation_tool",
      "reason": "source_unavailable",
      "detail": "The MOE release publishes word-frequency rows but does not identify a named segmentation tool."
    }
  ],
  "conflicts": [],
  "definitions_zh_TW": [
    {
      "text": "1.精神倦怠，體力衰弱。如：「現在工作繁重，身體常覺得疲弱不堪。」\n2.物價或股市、匯市等行情價格低落。如：「行情疲弱」。也作「疲軟」。",
      "lang": "zh-Hant-TW",
      "register": "dictionary",
      "source_id": "moe-tw-revised-dictionary-2015-20260625",
      "source_entry_id": "008310018",
      "verbatim": true
    }
  ]
}
