{
  "id": "moe1996-22296",
  "traditional": "落荒而逃",
  "simplified": "落荒而逃",
  "constituent_chars": [
    "U+843D",
    "U+8352",
    "U+800C",
    "U+9003"
  ],
  "pinyin": [
    {
      "reading": "luò huāng ér táo",
      "context": "dictionary_entry",
      "source_entry_ids": [
        "212800025"
      ]
    }
  ],
  "zhuyin": [
    {
      "reading": "ㄌㄨㄛˋ ㄏㄨㄤ ㄦˊ ㄊㄠˊ",
      "pinyin": "luò huāng ér táo",
      "source_entry_ids": [
        "212800025"
      ]
    }
  ],
  "definitions": [
    {
      "gloss": "to flee in defeat",
      "lang": "en",
      "register": "modern",
      "source_entry_indices": [
        94698
      ]
    },
    {
      "gloss": "to bolt",
      "lang": "en",
      "register": "modern",
      "source_entry_indices": [
        94698
      ]
    }
  ],
  "frequency": {
    "rank": 22296,
    "corpus_id": "moe-tw-common-terms-1996",
    "count": 2,
    "cumulative_count": 591130,
    "percentage": 0.00032399,
    "cumulative_percentage": 95.75963947,
    "per_million": 3.239884,
    "corpus_total_count": 617306
  },
  "grading": {
    "hsk": null
  },
  "segmentation_tool": null,
  "cc_cedict_entry_indices": [
    94698
  ],
  "sources": {
    "id": [
      "moe-tw-common-terms-1996"
    ],
    "traditional": [
      "moe-tw-common-terms-1996",
      "cc-cedict-editor-2026-08-11"
    ],
    "constituent_chars": [
      "moe-tw-common-terms-1996"
    ],
    "definitions": [
      "cc-cedict-editor-2026-08-11"
    ],
    "frequency": [
      "moe-tw-common-terms-1996"
    ],
    "cc_cedict_entry_indices": [
      "cc-cedict-editor-2026-08-11"
    ],
    "simplified": [
      "cc-cedict-editor-2026-08-11"
    ],
    "pinyin": [
      "moe-tw-concised-dictionary-2014-20260626"
    ],
    "zhuyin": [
      "moe-tw-concised-dictionary-2014-20260626"
    ],
    "definitions_zh_TW": [
      "moe-tw-concised-dictionary-2014-20260626"
    ]
  },
  "gaps": [
    {
      "field": "grading.hsk",
      "reason": "source_unavailable",
      "detail": "No versioned redistribution-approved HSK word source passed the Phase 0 audit."
    },
    {
      "field": "segmentation_tool",
      "reason": "source_unavailable",
      "detail": "The MOE release publishes word-frequency rows but does not identify a named segmentation tool."
    }
  ],
  "conflicts": [],
  "definitions_zh_TW": [
    {
      "text": "倉皇逃走。[例]那小偷一聽到防盜器鈴聲大作，嚇得馬上落荒而逃。",
      "lang": "zh-Hant-TW",
      "register": "dictionary",
      "source_id": "moe-tw-concised-dictionary-2014-20260626",
      "source_entry_id": "212800025",
      "verbatim": true
    }
  ]
}
