{
  "id": "moe1996-23922",
  "traditional": "攤子",
  "simplified": "摊子",
  "constituent_chars": [
    "U+6524",
    "U+5B50"
  ],
  "pinyin": [
    {
      "reading": "tān zi",
      "context": "dictionary_entry",
      "source_entry_ids": [
        "138100006"
      ]
    }
  ],
  "zhuyin": [
    {
      "reading": "ㄊㄢ ˙ㄗ",
      "pinyin": "tān zi",
      "source_entry_ids": [
        "138100006"
      ]
    }
  ],
  "definitions": [
    {
      "gloss": "booth; vendor's stall",
      "lang": "en",
      "register": "modern",
      "source_entry_indices": [
        49816
      ]
    },
    {
      "gloss": "(fig.) organizational structure; scale of operations",
      "lang": "en",
      "register": "modern",
      "source_entry_indices": [
        49816
      ]
    }
  ],
  "frequency": {
    "rank": 23922,
    "corpus_id": "moe-tw-common-terms-1996",
    "count": 2,
    "cumulative_count": 594382,
    "percentage": 0.00032399,
    "cumulative_percentage": 96.28644465,
    "per_million": 3.239884,
    "corpus_total_count": 617306
  },
  "grading": {
    "hsk": null
  },
  "segmentation_tool": null,
  "cc_cedict_entry_indices": [
    49816
  ],
  "sources": {
    "id": [
      "moe-tw-common-terms-1996"
    ],
    "traditional": [
      "moe-tw-common-terms-1996",
      "cc-cedict-editor-2026-08-11"
    ],
    "constituent_chars": [
      "moe-tw-common-terms-1996"
    ],
    "definitions": [
      "cc-cedict-editor-2026-08-11"
    ],
    "frequency": [
      "moe-tw-common-terms-1996"
    ],
    "cc_cedict_entry_indices": [
      "cc-cedict-editor-2026-08-11"
    ],
    "simplified": [
      "cc-cedict-editor-2026-08-11"
    ],
    "pinyin": [
      "moe-tw-concised-dictionary-2014-20260626"
    ],
    "zhuyin": [
      "moe-tw-concised-dictionary-2014-20260626"
    ],
    "definitions_zh_TW": [
      "moe-tw-concised-dictionary-2014-20260626"
    ]
  },
  "gaps": [
    {
      "field": "grading.hsk",
      "reason": "source_unavailable",
      "detail": "No versioned redistribution-approved HSK word source passed the Phase 0 audit."
    },
    {
      "field": "segmentation_tool",
      "reason": "source_unavailable",
      "detail": "The MOE release publishes word-frequency rows but does not identify a named segmentation tool."
    }
  ],
  "conflicts": [],
  "definitions_zh_TW": [
    {
      "text": "陳設在路旁的簡易售貨場所。[例]那個攤子所烹調的各種小吃，都相當精緻可口。",
      "lang": "zh-Hant-TW",
      "register": "dictionary",
      "source_id": "moe-tw-concised-dictionary-2014-20260626",
      "source_entry_id": "138100006",
      "verbatim": true
    }
  ]
}
