{
  "id": "moe1996-01145",
  "traditional": "艘",
  "simplified": "艘",
  "constituent_chars": [
    "U+8258"
  ],
  "pinyin": [
    {
      "reading": "sāo",
      "context": "dictionary_entry",
      "source_entry_ids": [
        "5605"
      ]
    }
  ],
  "zhuyin": [
    {
      "reading": "ㄙㄠ",
      "pinyin": "sāo",
      "source_entry_ids": [
        "5605"
      ]
    }
  ],
  "definitions": [
    {
      "gloss": "classifier for ships",
      "lang": "en",
      "register": "modern",
      "source_entry_indices": [
        92508
      ]
    },
    {
      "gloss": "Taiwan pr. [sao1]",
      "lang": "en",
      "register": "modern",
      "source_entry_indices": [
        92508
      ]
    }
  ],
  "frequency": {
    "rank": 1145,
    "corpus_id": "moe-tw-common-terms-1996",
    "count": 70,
    "cumulative_count": 408816,
    "percentage": 0.01133959,
    "cumulative_percentage": 66.22582641,
    "per_million": 113.395949,
    "corpus_total_count": 617306
  },
  "grading": {
    "hsk": null
  },
  "segmentation_tool": null,
  "cc_cedict_entry_indices": [
    92508
  ],
  "sources": {
    "id": [
      "moe-tw-common-terms-1996"
    ],
    "traditional": [
      "moe-tw-common-terms-1996",
      "cc-cedict-editor-2026-08-11"
    ],
    "constituent_chars": [
      "moe-tw-common-terms-1996"
    ],
    "definitions": [
      "cc-cedict-editor-2026-08-11"
    ],
    "frequency": [
      "moe-tw-common-terms-1996"
    ],
    "cc_cedict_entry_indices": [
      "cc-cedict-editor-2026-08-11"
    ],
    "simplified": [
      "cc-cedict-editor-2026-08-11"
    ],
    "pinyin": [
      "moe-tw-concised-dictionary-2014-20260626"
    ],
    "zhuyin": [
      "moe-tw-concised-dictionary-2014-20260626"
    ],
    "definitions_zh_TW": [
      "moe-tw-concised-dictionary-2014-20260626"
    ]
  },
  "gaps": [
    {
      "field": "grading.hsk",
      "reason": "source_unavailable",
      "detail": "No versioned redistribution-approved HSK word source passed the Phase 0 audit."
    },
    {
      "field": "segmentation_tool",
      "reason": "source_unavailable",
      "detail": "The MOE release publishes word-frequency rows but does not identify a named segmentation tool."
    }
  ],
  "conflicts": [
    {
      "field": "pinyin",
      "resolution": "taiwan_moe_canonical",
      "values": [
        {
          "value": [
            "sāo"
          ],
          "source_ids": [
            "moe-tw-concised-dictionary-2014-20260626"
          ],
          "source_entry_ids": [
            "5605"
          ]
        },
        {
          "value": [
            "sōu"
          ],
          "source_ids": [
            "cc-cedict-editor-2026-08-11"
          ],
          "source_entry_indices": [
            92508
          ]
        }
      ],
      "detail": "The exact Taiwan MOE Concised Dictionary headword reading is canonical for this Traditional-first corpus. The differing CC-CEDICT reading set is retained as regional or lexical comparison evidence."
    },
    {
      "field": "zhuyin",
      "resolution": "taiwan_moe_canonical",
      "values": [
        {
          "value": [
            {
              "pinyin": "sāo",
              "reading": "ㄙㄠ"
            }
          ],
          "source_ids": [
            "moe-tw-concised-dictionary-2014-20260626"
          ],
          "source_entry_ids": [
            "5605"
          ]
        },
        {
          "value": [
            {
              "pinyin": "sōu",
              "reading": "ㄙㄡ"
            }
          ],
          "source_ids": [
            "cc-cedict-editor-2026-08-11",
            "cns11643-attributes-2026-08-05"
          ],
          "source_entry_indices": [
            92508
          ]
        }
      ],
      "detail": "The Taiwan MOE Concised Dictionary Zhuyin is canonical. The previous value was mechanically converted from CC-CEDICT Pinyin through the CNS syllable table and remains comparison evidence."
    }
  ],
  "definitions_zh_TW": [
    {
      "text": "1.舟船的總稱。[例]糧艘、艘楫\n2.量詞。計算船隻、艦艇的單位。[例]一艘船、十艘軍艦",
      "lang": "zh-Hant-TW",
      "register": "dictionary",
      "source_id": "moe-tw-concised-dictionary-2014-20260626",
      "source_entry_id": "5605",
      "verbatim": true
    }
  ]
}
