{
  "id": "moe1996-04386",
  "traditional": "痘痘",
  "simplified": "痘痘",
  "constituent_chars": [
    "U+75D8",
    "U+75D8"
  ],
  "pinyin": [
    {
      "reading": "dòu dòu",
      "context": "dictionary_entry",
      "source_entry_ids": [
        "0199100021"
      ]
    }
  ],
  "zhuyin": [
    {
      "reading": "ㄉㄡˋ ㄉㄡˋ",
      "pinyin": "dòu dòu",
      "source_entry_ids": [
        "0199100021"
      ]
    }
  ],
  "definitions": [
    {
      "gloss": "pimple; zit; (by extension) acne",
      "lang": "en",
      "register": "modern",
      "source_entry_indices": [
        75601
      ]
    }
  ],
  "frequency": {
    "rank": 4386,
    "corpus_id": "moe-tw-common-terms-1996",
    "count": 15,
    "cumulative_count": 506556,
    "percentage": 0.00242991,
    "cumulative_percentage": 82.05914085,
    "per_million": 24.299132,
    "corpus_total_count": 617306
  },
  "grading": {
    "hsk": null
  },
  "segmentation_tool": null,
  "cc_cedict_entry_indices": [
    75601
  ],
  "sources": {
    "id": [
      "moe-tw-common-terms-1996"
    ],
    "traditional": [
      "moe-tw-common-terms-1996",
      "cc-cedict-editor-2026-08-11"
    ],
    "constituent_chars": [
      "moe-tw-common-terms-1996"
    ],
    "definitions": [
      "cc-cedict-editor-2026-08-11"
    ],
    "frequency": [
      "moe-tw-common-terms-1996"
    ],
    "cc_cedict_entry_indices": [
      "cc-cedict-editor-2026-08-11"
    ],
    "simplified": [
      "cc-cedict-editor-2026-08-11"
    ],
    "pinyin": [
      "moe-tw-revised-dictionary-2015-20260625"
    ],
    "zhuyin": [
      "moe-tw-revised-dictionary-2015-20260625"
    ],
    "definitions_zh_TW": [
      "moe-tw-revised-dictionary-2015-20260625"
    ]
  },
  "gaps": [
    {
      "field": "grading.hsk",
      "reason": "source_unavailable",
      "detail": "No versioned redistribution-approved HSK word source passed the Phase 0 audit."
    },
    {
      "field": "segmentation_tool",
      "reason": "source_unavailable",
      "detail": "The MOE release publishes word-frequency rows but does not identify a named segmentation tool."
    }
  ],
  "conflicts": [],
  "definitions_zh_TW": [
    {
      "text": "青春痘的俗稱。",
      "lang": "zh-Hant-TW",
      "register": "dictionary",
      "source_id": "moe-tw-revised-dictionary-2015-20260625",
      "source_entry_id": "0199100021",
      "verbatim": true
    }
  ]
}
