{
  "id": "moe1996-02947",
  "traditional": "輔導",
  "simplified": "辅导",
  "constituent_chars": [
    "U+8F14",
    "U+5C0E"
  ],
  "pinyin": [
    {
      "reading": "fǔ dǎo",
      "context": "dictionary_entry",
      "source_entry_ids": [
        "097500003"
      ]
    }
  ],
  "zhuyin": [
    {
      "reading": "ㄈㄨˇ ㄉㄠˇ",
      "pinyin": "fǔ dǎo",
      "source_entry_ids": [
        "097500003"
      ]
    }
  ],
  "definitions": [
    {
      "gloss": "to guide; to mentor; to counsel; to coach; to tutor",
      "lang": "en",
      "register": "modern",
      "source_entry_indices": [
        105839
      ]
    }
  ],
  "frequency": {
    "rank": 2947,
    "corpus_id": "moe-tw-common-terms-1996",
    "count": 24,
    "cumulative_count": 479691,
    "percentage": 0.00388786,
    "cumulative_percentage": 77.7071663,
    "per_million": 38.878611,
    "corpus_total_count": 617306
  },
  "grading": {
    "hsk": null
  },
  "segmentation_tool": null,
  "cc_cedict_entry_indices": [
    105839
  ],
  "sources": {
    "id": [
      "moe-tw-common-terms-1996"
    ],
    "traditional": [
      "moe-tw-common-terms-1996",
      "cc-cedict-editor-2026-08-11"
    ],
    "constituent_chars": [
      "moe-tw-common-terms-1996"
    ],
    "definitions": [
      "cc-cedict-editor-2026-08-11"
    ],
    "frequency": [
      "moe-tw-common-terms-1996"
    ],
    "cc_cedict_entry_indices": [
      "cc-cedict-editor-2026-08-11"
    ],
    "simplified": [
      "cc-cedict-editor-2026-08-11"
    ],
    "pinyin": [
      "moe-tw-concised-dictionary-2014-20260626"
    ],
    "zhuyin": [
      "moe-tw-concised-dictionary-2014-20260626"
    ],
    "definitions_zh_TW": [
      "moe-tw-concised-dictionary-2014-20260626"
    ]
  },
  "gaps": [
    {
      "field": "grading.hsk",
      "reason": "source_unavailable",
      "detail": "No versioned redistribution-approved HSK word source passed the Phase 0 audit."
    },
    {
      "field": "segmentation_tool",
      "reason": "source_unavailable",
      "detail": "The MOE release publishes word-frequency rows but does not identify a named segmentation tool."
    }
  ],
  "conflicts": [],
  "definitions_zh_TW": [
    {
      "text": "輔助引導。[例]行為輔導、生活輔導",
      "lang": "zh-Hant-TW",
      "register": "dictionary",
      "source_id": "moe-tw-concised-dictionary-2014-20260626",
      "source_entry_id": "097500003",
      "verbatim": true
    }
  ]
}
